{
  "schemaVersion": "1",
  "type": "comparison",
  "title": "服务条款描述调整",
  "modules": [
    {
      "type": "text",
      "name": "用户隐私与数据收集声明",
      "before": "我们可能会收集包括您所访问的网页地址、IP 地址、设备标识符等信息，用于保障基本的系统安全性与日志留存。",
      "after": "我们仅在获得您的明确授权下收集经过不可逆哈希处理的匿名统计遥测数据，绝不存储明文原始 IP 或与第三方实体共享。"
    }
  ]
}
