{
  "schemaVersion": "1",
  "type": "comparison",
  "title": "点赞互动计数变更",
  "time": "2026-09-08 13:40:02",
  "modules": [
    {
      "type": "metric",
      "name": "点赞数",
      "items": [
        {
          "label": "Likes Count",
          "before": "42,540",
          "after": "42,541"
        }
      ]
    }
  ]
}
