{
  "schemaVersion": "1",
  "type": "comparison",
  "title": "品牌主页横幅视觉图更新",
  "modules": [
    {
      "type": "image",
      "name": "横幅主图",
      "before": {
        "label": "旧版设计",
        "url": "https://images.unsplash.com/photo-1519608487953-e999c86e7455?auto=format&fit=crop&w=800&h=360&q=82"
      },
      "after": {
        "label": "新版设计",
        "url": "https://images.unsplash.com/photo-1497366811353-6870744d04b2?auto=format&fit=crop&w=800&h=360&q=82"
      }
    }
  ]
}
